{"$schema":"https://json-schema.org/draft/2020-12/schema","type":"object","required":["schemaVersion","sourceVersion","profileVersion","generatorVersion","rulesVersion","capabilityRegistryVersion","metadataFingerprint","exerciseId","displayName","aliases","approval","instruction","cadence","phrases","poseAnalysis","cameraGuidance","automatedAnalysisScope","limitations","unsupportedAssessments","runtimeContract"],"properties":{"schemaVersion":{"type":"integer"},"sourceVersion":{"type":"integer"},"profileVersion":{"type":"integer"},"generatorVersion":{"type":"string"},"rulesVersion":{"type":"string"},"capabilityRegistryVersion":{"type":"string"},"metadataFingerprint":{"type":"string","pattern":"^sha256:"},"exerciseId":{"type":"string"},"displayName":{"type":"string"},"aliases":{"type":"array"},"approval":{"type":"object"},"instruction":{"type":"object"},"cadence":{"type":"object"},"phrases":{"type":"object"},"poseAnalysis":{"type":"object"},"cameraGuidance":{"type":"string"},"automatedAnalysisScope":{"type":"string"},"limitations":{"type":"array"},"unsupportedAssessments":{"type":"array"},"runtimeContract":{"type":"object"}}}
