{
  "schemaVersion": 1,
  "exerciseId": "push_up",
  "sourceVersion": 2,
  "profileVersion": 2,
  "generatorVersion": "2.0.0",
  "rulesVersion": "1.0.0",
  "capabilityRegistryVersion": "1.0.0",
  "metadataFingerprint": "sha256:790aeedc2dbf92cf9d8084c065fe4e899f0868bb753aa1b231d4d4604f276361",
  "displayName": "Push-Up",
  "aliases": [
    "pushup",
    "push-up"
  ],
  "approval": {
    "status": "draft",
    "reviewerId": null,
    "reviewedAt": null,
    "notes": "Awaiting qualified trainer review."
  },
  "instruction": {
    "setupCues": [
      "Place your hands approximately under your shoulders.",
      "Brace in a straight line from shoulders to heels."
    ],
    "movementCues": [
      "Lower your body with control, pause, then press the floor away.",
      "Inhale as you lower. Exhale as you press."
    ],
    "safetyCues": [
      "Perform each repetition with control.",
      "Stop the exercise if you experience unexpected pain.",
      "Breathe normally throughout the movement."
    ]
  },
  "cadence": {
    "phaseOne": "Lower",
    "hold": "Hold",
    "phaseTwo": "Press"
  },
  "phrases": {
    "encouragement": [
      {
        "id": "push_up_encouragement_1",
        "template": "Keep your body in one straight line.",
        "supportsName": false
      },
      {
        "id": "push_up_encouragement_2",
        "template": "Stay controlled.",
        "supportsName": false
      }
    ],
    "positiveForm": [
      {
        "id": "push_up_form_positive_1",
        "template": "Your body alignment stayed controlled.",
        "supportsName": false
      }
    ],
    "correctiveForm": [
      {
        "id": "push_up_form_corrective_1",
        "template": "On the next set, try keeping your hips in line with your shoulders.",
        "supportsName": false
      }
    ],
    "uncertainForm": [
      {
        "id": "push_up_form_uncertain_1",
        "template": "I could not get a clear enough side view to evaluate your body alignment.",
        "supportsName": false
      }
    ],
    "completion": [
      {
        "id": "push_up_completion_1",
        "template": "Good job.",
        "supportsName": false
      }
    ],
    "recovery": [
      {
        "id": "push_up_recovery_1",
        "template": "Take a breath.",
        "supportsName": false
      }
    ]
  },
  "poseAnalysis": {
    "supported": true,
    "capabilityId": "push_up.side.body_alignment",
    "validationStatus": "trainer_review_required",
    "requiredView": "side",
    "minimumUsableFramePercentage": 60,
    "minimumOverallConfidence": 0.75,
    "rules": [
      {
        "id": "body_alignment",
        "type": "alignment_deviation",
        "measurement": "alignment_deviation",
        "landmarks": [
          "shoulder",
          "hip",
          "ankle"
        ],
        "thresholds": {
          "maximumDeviationDegrees": 18
        },
        "minimumLandmarkConfidence": 0.75,
        "minimumAffectedFramePercentage": 35,
        "minimumConsecutiveDurationMs": 500,
        "priority": 1,
        "feedback": {
          "good": "push_up_form_positive_1",
          "needsAttention": "push_up_form_corrective_1",
          "uncertain": "push_up_form_uncertain_1"
        }
      }
    ]
  },
  "cameraGuidance": "Position the camera at the side and keep the shoulders, hips, and ankles visible throughout the movement. Avoid major landmark occlusion.",
  "automatedAnalysisScope": "Automated assessment evaluates shoulder–hip–ankle body alignment only.",
  "limitations": [
    "A two-dimensional shoulder–hip–ankle angle cannot assess wrist comfort, pain, elbow angle, depth, or full three-dimensional alignment.",
    "Camera placement, lighting, landmark occlusion, and incomplete body visibility may reduce pose-estimation reliability."
  ],
  "unsupportedAssessments": [
    "pain",
    "wrist_comfort",
    "elbow_angle",
    "depth",
    "three_dimensional_alignment"
  ],
  "runtimeContract": {
    "poseTraceCompatible": true,
    "sessionRecorderCompatible": true,
    "comparisonInput": "normalized_pose_trace"
  }
}
